{
  "schema_version": "c2.check.v0.4-draft",
  "is_sample": true,
  "check_id": "chk_fixture_0001",
  "status": "failed",
  "input": {
    "url": "https://www.example.com/",
    "normalized_url": "https://www.example.com/",
    "lang": "en"
  },
  "created_at": "2026-10-28T10:00:00Z",
  "started_at": "2026-10-28T10:00:00Z",
  "finished_at": "2026-10-28T10:00:00Z",
  "expires_at": "2026-11-04T10:00:00Z",
  "limits": {
    "max_pages": 5,
    "max_requests": 20,
    "max_dns_lookups": 30,
    "request_timeout_ms": 10000,
    "job_timeout_ms": 60000,
    "max_body_bytes": 2097152
  },
  "coverage": {
    "site_host": null,
    "pages_selected": 1,
    "pages_fetched": 0,
    "pages_failed": 1,
    "pages_skipped": 0,
    "requests_used": 2,
    "requests_limit": 20,
    "dns_lookups_used": 2,
    "dns_lookups_limit": 30,
    "links_found": 0,
    "links_checked": 0,
    "links_not_checked": 0,
    "links_not_checked_by_reason": {},
    "robots_txt": "absent",
    "robots_origins": [
      {
        "origin": "https://www.example.com",
        "state": "absent",
        "http_status": 404,
        "reason": null
      }
    ],
    "stopped_reason": null,
    "checks_not_run": []
  },
  "pages": [
    {
      "url": "https://www.example.com/",
      "final_url": null,
      "fetch_status": "error",
      "http_status": null,
      "redirect_chain": [
        {
          "url": "https://www.example.com/",
          "http_status": 301,
          "location": "http://metadata.internal.example.com/latest/"
        }
      ],
      "content_type": null,
      "bytes": null,
      "fetch_ms": 0,
      "error_code": "redirect_to_blocked_destination",
      "measured": null,
      "evidence_ids": [],
      "fetched_at": "2026-10-28T10:00:00Z",
      "body_sha256": null
    }
  ],
  "links": [],
  "findings": [],
  "evidence": [],
  "explanation": {
    "status": "not_available",
    "lang": "en",
    "items": [],
    "reason": null,
    "is_test": false
  },
  "errors": [
    {
      "code": "redirect_to_blocked_destination",
      "url": "https://www.example.com/",
      "message": "This address cannot be checked."
    }
  ],
  "request_log": [
    {
      "seq": 1,
      "purpose": "robots",
      "method": "GET",
      "url": "https://www.example.com/robots.txt",
      "connect_ip": "93.184.215.14",
      "result": 404
    },
    {
      "seq": 2,
      "purpose": "page",
      "method": "GET",
      "url": "https://www.example.com/",
      "connect_ip": "93.184.215.14",
      "result": 301
    }
  ],
  "disclaimer": "Automated check of raw HTML for up to 5 pages of one site. Not a ranking, traffic or backlink measurement. Items not checked are listed in coverage.",
  "sample_note": "SAMPLE ONLY - generated from local fixtures with a fake resolver and transport; no real network request was made."
}
